{
  "schema_version": 1,
  "receipt_id": "99999999-9999-4999-8999-999999999999",
  "intent_id": "11111111-1111-4111-8111-111111111111",
  "idempotency_key": "cmd.plan.1.1",
  "grant_id": "77777777-7777-4777-8777-777777777777",
  "authority_not_after": "2026-07-20T03:05:00.000Z",
  "original_intent_content_hash": "aaaaaaaaaaaaaaaaaaaaaaaaaaaaaaaaaaaaaaaaaaaaaaaaaaaaaaaaaaaaaaaa",
  "execution_intent_content_hash": "bbbbbbbbbbbbbbbbbbbbbbbbbbbbbbbbbbbbbbbbbbbbbbbbbbbbbbbbbbbbbbbb",
  "capability_hash": "cccccccccccccccccccccccccccccccccccccccccccccccccccccccccccccccc",
  "purpose": "operator_approved",
  "status": "execution_succeeded",
  "reason_code": null,
  "target_level": 3,
  "observed_level": 3,
  "readback_quality": "ok",
  "writes": [
    { "kind": "writeHoldingRegister", "point": "Op_gate", "address": 108, "value": 3 },
    { "kind": "writeCoil", "point": "GateCF", "address": 17, "value": 1 }
  ],
  "executed_at": "2026-07-20T03:00:00.000Z"
}
